city,canton,target_keyword,volume,position,notes
Lugano,TI,costo vita lugano,720,n/a,Largest Ticino city; anchor search term
Mendrisio,TI,costo vita mendrisio,170,n/a,Commuter hub near Chiasso crossing; growing tech/finance cluster
Chiasso,TI,costo vita chiasso,140,n/a,Primary border crossing; highest frontaliere density
Bellinzona,TI,costo vita bellinzona,110,n/a,Cantonal capital; lowest rents among the 6
Locarno,TI,costo vita locarno,90,n/a,Lake Maggiore area; retirement + tourism market
Ticino,TI,costo vita ticino,210,n/a,Regional rollup; aggregates CH side vs Como/Varese/Lecco/Sondrio IT
