url;keyword;position;volume;kd;notes;seo_pages_key
https://frontaliereticino.ch/tasse-e-pensione/festivita-ticino/;festivi in ticino;19;720;~15;Highest volume. Two keywords share this URL ("festivi in ticino" vol 720 + "festa canton ticino" vol 210). Already has rich content/FAQ. Meta description already keyword-targeted. Strike-distance play: tighten title to front-load "festivi in ticino"; add 3 PAA Q&A on "festa canton ticino";holidays
https://frontaliereticino.ch/guida-frontaliere/mappa-confine/;mappa confine italia svizzera;14;260;~20;Already has abstract + FAQPage. Strike-distance play: front-load keyword in title, add 3 PAA Q&A targeting geographic synonyms (mappa dogane, mappa valichi);border-map
https://frontaliereticino.ch/guida-frontaliere/disoccupazione-transfrontaliera/;svizzera disoccupazione;20;210;~18;Has FAQ. 4 related low-hanging keywords all cluster here (pos 14-20). Strike-distance play: restructure title around "disoccupazione svizzera frontalieri"; add PAA for "se ho lavorato in svizzera risulto disoccupato in italia" long-tail query;unemployment
https://frontaliereticino.ch/guida-frontaliere/tempi-attesa-dogana/;traffico dogana chiasso;18;90;~15;Has FAQ. Strike-distance play: add explicit Chiasso coverage in title/meta/FAQ + add 3 Chiasso-specific Q&A (Brogeda vs Ponte Chiasso vs Chiasso Strada);border
https://frontaliereticino.ch/vivere-in-ticino/aziende-svizzera-italiana/;nomi ditte in svizzera che assumono;18;90;~18;No FAQPage currently. Strike-distance play: add FAQPage with 3 Q&A + front-load "aziende che assumono in Ticino" in title; broaden to "aziende in canton ticino" long-tail (pos 19 vol 90);companies
https://frontaliereticino.ch/compara-servizi/costo-della-vita/;costo vita svizzera vs italia;11;70;~22;Position 11 — closest to page 1. Rich FAQ already. Strike-distance play: tighten title to exact keyword "costo vita svizzera vs italia" + add 3 PAA on Lugano/Como comparison angle;cost-of-living
